<?xml version="1.0" encoding="UTF-8"?>
<tns:worldCup xmlns:tns="http://www.example.org/WorldCupSchema" xmlns:xsi="http://www.w3.org/2001/XMLSchema-instance" xsi:schemaLocation="http://www.example.org/WorldCupSchema ../../../bin/swc/file/WorldCupSchema.xsd ">
  <tns:name>tns:name</tns:name>
  <tns:groups>
    <tns:groupName>tns:groupName</tns:groupName>
    <tns:teams>
      <tns:strName>tns:strName</tns:strName>
      <tns:points>0</tns:points>
      <tns:gf>0</tns:gf>
      <tns:ga>0</tns:ga>
      <tns:played>0</tns:played>
      <tns:won>0</tns:won>
      <tns:lost>0</tns:lost>
      <tns:drawn>0</tns:drawn>
    </tns:teams>
    <tns:teams>
      <tns:strName>tns:strName</tns:strName>
      <tns:points>0</tns:points>
      <tns:gf>0</tns:gf>
      <tns:ga>0</tns:ga>
      <tns:played>0</tns:played>
      <tns:won>0</tns:won>
      <tns:lost>0</tns:lost>
      <tns:drawn>0</tns:drawn>
    </tns:teams>
    <tns:teams>
      <tns:strName>tns:strName</tns:strName>
      <tns:points>0</tns:points>
      <tns:gf>0</tns:gf>
      <tns:ga>0</tns:ga>
      <tns:played>0</tns:played>
      <tns:won>0</tns:won>
      <tns:lost>0</tns:lost>
      <tns:drawn>0</tns:drawn>
    </tns:teams>
    <tns:teams>
      <tns:strName>tns:strName</tns:strName>
      <tns:points>0</tns:points>
      <tns:gf>0</tns:gf>
      <tns:ga>0</tns:ga>
      <tns:played>0</tns:played>
      <tns:won>0</tns:won>
      <tns:lost>0</tns:lost>
      <tns:drawn>0</tns:drawn>
    </tns:teams>
    <tns:games>
      <tns:time>tns:time</tns:time>
      <tns:date>tns:date</tns:date>
      <tns:location>tns:location</tns:location>
      <tns:goalsH>0</tns:goalsH>
      <tns:goalsG>0</tns:goalsG>
      <tns:isPlayed>true</tns:isPlayed>
      <tns:teamH>tns:teamH</tns:teamH>
      <tns:teamG>tns:teamG</tns:teamG>
    </tns:games>
    <tns:games>
      <tns:time>tns:time</tns:time>
      <tns:date>tns:date</tns:date>
      <tns:location>tns:location</tns:location>
      <tns:goalsH>0</tns:goalsH>
      <tns:goalsG>0</tns:goalsG>
      <tns:isPlayed>true</tns:isPlayed>
      <tns:teamH>tns:teamH</tns:teamH>
      <tns:teamG>tns:teamG</tns:teamG>
    </tns:games>
    <tns:games>
      <tns:time>tns:time</tns:time>
      <tns:date>tns:date</tns:date>
      <tns:location>tns:location</tns:location>
      <tns:goalsH>0</tns:goalsH>
      <tns:goalsG>0</tns:goalsG>
      <tns:isPlayed>true</tns:isPlayed>
      <tns:teamH>tns:teamH</tns:teamH>
      <tns:teamG>tns:teamG</tns:teamG>
    </tns:games>
    <tns:games>
      <tns:time>tns:time</tns:time>
      <tns:date>tns:date</tns:date>
      <tns:location>tns:location</tns:location>
      <tns:goalsH>0</tns:goalsH>
      <tns:goalsG>0</tns:goalsG>
      <tns:isPlayed>true</tns:isPlayed>
      <tns:teamH>tns:teamH</tns:teamH>
      <tns:teamG>tns:teamG</tns:teamG>
    </tns:games>
    <tns:games>
      <tns:time>tns:time</tns:time>
      <tns:date>tns:date</tns:date>
      <tns:location>tns:location</tns:location>
      <tns:goalsH>0</tns:goalsH>
      <tns:goalsG>0</tns:goalsG>
      <tns:isPlayed>true</tns:isPlayed>
      <tns:teamH>tns:teamH</tns:teamH>
      <tns:teamG>tns:teamG</tns:teamG>
    </tns:games>
    <tns:games>
      <tns:time>tns:time</tns:time>
      <tns:date>tns:date</tns:date>
      <tns:location>tns:location</tns:location>
      <tns:goalsH>0</tns:goalsH>
      <tns:goalsG>0</tns:goalsG>
      <tns:isPlayed>true</tns:isPlayed>
      <tns:teamH>tns:teamH</tns:teamH>
      <tns:teamG>tns:teamG</tns:teamG>
    </tns:games>
  </tns:groups>
  <tns:groups>
    <tns:groupName>tns:groupName</tns:groupName>
    <tns:teams>
      <tns:strName>tns:strName</tns:strName>
      <tns:points>0</tns:points>
      <tns:gf>0</tns:gf>
      <tns:ga>0</tns:ga>
      <tns:played>0</tns:played>
      <tns:won>0</tns:won>
      <tns:lost>0</tns:lost>
      <tns:drawn>0</tns:drawn>
    </tns:teams>
    <tns:teams>
      <tns:strName>tns:strName</tns:strName>
      <tns:points>0</tns:points>
      <tns:gf>0</tns:gf>
      <tns:ga>0</tns:ga>
      <tns:played>0</tns:played>
      <tns:won>0</tns:won>
      <tns:lost>0</tns:lost>
      <tns:drawn>0</tns:drawn>
    </tns:teams>
    <tns:teams>
      <tns:strName>tns:strName</tns:strName>
      <tns:points>0</tns:points>
      <tns:gf>0</tns:gf>
      <tns:ga>0</tns:ga>
      <tns:played>0</tns:played>
      <tns:won>0</tns:won>
      <tns:lost>0</tns:lost>
      <tns:drawn>0</tns:drawn>
    </tns:teams>
    <tns:teams>
      <tns:strName>tns:strName</tns:strName>
      <tns:points>0</tns:points>
      <tns:gf>0</tns:gf>
      <tns:ga>0</tns:ga>
      <tns:played>0</tns:played>
      <tns:won>0</tns:won>
      <tns:lost>0</tns:lost>
      <tns:drawn>0</tns:drawn>
    </tns:teams>
    <tns:games>
      <tns:time>tns:time</tns:time>
      <tns:date>tns:date</tns:date>
      <tns:location>tns:location</tns:location>
      <tns:goalsH>0</tns:goalsH>
      <tns:goalsG>0</tns:goalsG>
      <tns:isPlayed>true</tns:isPlayed>
      <tns:teamH>tns:teamH</tns:teamH>
      <tns:teamG>tns:teamG</tns:teamG>
    </tns:games>
    <tns:games>
      <tns:time>tns:time</tns:time>
      <tns:date>tns:date</tns:date>
      <tns:location>tns:location</tns:location>
      <tns:goalsH>0</tns:goalsH>
      <tns:goalsG>0</tns:goalsG>
      <tns:isPlayed>true</tns:isPlayed>
      <tns:teamH>tns:teamH</tns:teamH>
      <tns:teamG>tns:teamG</tns:teamG>
    </tns:games>
    <tns:games>
      <tns:time>tns:time</tns:time>
      <tns:date>tns:date</tns:date>
      <tns:location>tns:location</tns:location>
      <tns:goalsH>0</tns:goalsH>
      <tns:goalsG>0</tns:goalsG>
      <tns:isPlayed>true</tns:isPlayed>
      <tns:teamH>tns:teamH</tns:teamH>
      <tns:teamG>tns:teamG</tns:teamG>
    </tns:games>
    <tns:games>
      <tns:time>tns:time</tns:time>
      <tns:date>tns:date</tns:date>
      <tns:location>tns:location</tns:location>
      <tns:goalsH>0</tns:goalsH>
      <tns:goalsG>0</tns:goalsG>
      <tns:isPlayed>true</tns:isPlayed>
      <tns:teamH>tns:teamH</tns:teamH>
      <tns:teamG>tns:teamG</tns:teamG>
    </tns:games>
    <tns:games>
      <tns:time>tns:time</tns:time>
      <tns:date>tns:date</tns:date>
      <tns:location>tns:location</tns:location>
      <tns:goalsH>0</tns:goalsH>
      <tns:goalsG>0</tns:goalsG>
      <tns:isPlayed>true</tns:isPlayed>
      <tns:teamH>tns:teamH</tns:teamH>
      <tns:teamG>tns:teamG</tns:teamG>
    </tns:games>
    <tns:games>
      <tns:time>tns:time</tns:time>
      <tns:date>tns:date</tns:date>
      <tns:location>tns:location</tns:location>
      <tns:goalsH>0</tns:goalsH>
      <tns:goalsG>0</tns:goalsG>
      <tns:isPlayed>true</tns:isPlayed>
      <tns:teamH>tns:teamH</tns:teamH>
      <tns:teamG>tns:teamG</tns:teamG>
    </tns:games>
  </tns:groups>
  <tns:groups>
    <tns:groupName>tns:groupName</tns:groupName>
    <tns:teams>
      <tns:strName>tns:strName</tns:strName>
      <tns:points>0</tns:points>
      <tns:gf>0</tns:gf>
      <tns:ga>0</tns:ga>
      <tns:played>0</tns:played>
      <tns:won>0</tns:won>
      <tns:lost>0</tns:lost>
      <tns:drawn>0</tns:drawn>
    </tns:teams>
    <tns:teams>
      <tns:strName>tns:strName</tns:strName>
      <tns:points>0</tns:points>
      <tns:gf>0</tns:gf>
      <tns:ga>0</tns:ga>
      <tns:played>0</tns:played>
      <tns:won>0</tns:won>
      <tns:lost>0</tns:lost>
      <tns:drawn>0</tns:drawn>
    </tns:teams>
    <tns:teams>
      <tns:strName>tns:strName</tns:strName>
      <tns:points>0</tns:points>
      <tns:gf>0</tns:gf>
      <tns:ga>0</tns:ga>
      <tns:played>0</tns:played>
      <tns:won>0</tns:won>
      <tns:lost>0</tns:lost>
      <tns:drawn>0</tns:drawn>
    </tns:teams>
    <tns:teams>
      <tns:strName>tns:strName</tns:strName>
      <tns:points>0</tns:points>
      <tns:gf>0</tns:gf>
      <tns:ga>0</tns:ga>
      <tns:played>0</tns:played>
      <tns:won>0</tns:won>
      <tns:lost>0</tns:lost>
      <tns:drawn>0</tns:drawn>
    </tns:teams>
    <tns:games>
      <tns:time>tns:time</tns:time>
      <tns:date>tns:date</tns:date>
      <tns:location>tns:location</tns:location>
      <tns:goalsH>0</tns:goalsH>
      <tns:goalsG>0</tns:goalsG>
      <tns:isPlayed>true</tns:isPlayed>
      <tns:teamH>tns:teamH</tns:teamH>
      <tns:teamG>tns:teamG</tns:teamG>
    </tns:games>
    <tns:games>
      <tns:time>tns:time</tns:time>
      <tns:date>tns:date</tns:date>
      <tns:location>tns:location</tns:location>
      <tns:goalsH>0</tns:goalsH>
      <tns:goalsG>0</tns:goalsG>
      <tns:isPlayed>true</tns:isPlayed>
      <tns:teamH>tns:teamH</tns:teamH>
      <tns:teamG>tns:teamG</tns:teamG>
    </tns:games>
    <tns:games>
      <tns:time>tns:time</tns:time>
      <tns:date>tns:date</tns:date>
      <tns:location>tns:location</tns:location>
      <tns:goalsH>0</tns:goalsH>
      <tns:goalsG>0</tns:goalsG>
      <tns:isPlayed>true</tns:isPlayed>
      <tns:teamH>tns:teamH</tns:teamH>
      <tns:teamG>tns:teamG</tns:teamG>
    </tns:games>
    <tns:games>
      <tns:time>tns:time</tns:time>
      <tns:date>tns:date</tns:date>
      <tns:location>tns:location</tns:location>
      <tns:goalsH>0</tns:goalsH>
      <tns:goalsG>0</tns:goalsG>
      <tns:isPlayed>true</tns:isPlayed>
      <tns:teamH>tns:teamH</tns:teamH>
      <tns:teamG>tns:teamG</tns:teamG>
    </tns:games>
    <tns:games>
      <tns:time>tns:time</tns:time>
      <tns:date>tns:date</tns:date>
      <tns:location>tns:location</tns:location>
      <tns:goalsH>0</tns:goalsH>
      <tns:goalsG>0</tns:goalsG>
      <tns:isPlayed>true</tns:isPlayed>
      <tns:teamH>tns:teamH</tns:teamH>
      <tns:teamG>tns:teamG</tns:teamG>
    </tns:games>
    <tns:games>
      <tns:time>tns:time</tns:time>
      <tns:date>tns:date</tns:date>
      <tns:location>tns:location</tns:location>
      <tns:goalsH>0</tns:goalsH>
      <tns:goalsG>0</tns:goalsG>
      <tns:isPlayed>true</tns:isPlayed>
      <tns:teamH>tns:teamH</tns:teamH>
      <tns:teamG>tns:teamG</tns:teamG>
    </tns:games>
  </tns:groups>
  <tns:groups>